### ISSUE TITLE
Release 2022.10 - RC3

### ISSUE THREAD

**Issue by maribu** [RIOT-OS/Release-Specs#266]
This issue lists the status of all tests for the [Release Candidate 3 of the 2022.10](https://github.com/RIOT-OS/RIOT/releases/tag/2022.10-RC3) release.

Specs tested:
- [x] [01-ci](https://github.com/RIOT-OS/Release-Specs/blob/78debbc2a57885d2f4dce88d51f8c64183f1993d/01-ci/README.md)
  - [x] [Task #01 - Compile test](https://github.com/RIOT-OS/Release-Specs/blob/78debbc2a57885d2f4dce88d51f8c64183f1993d/01-ci/README.md#task-01---compile-test)
  - [x] [Task #02 - Unittests on native](https://github.com/RIOT-OS/Release-Specs/blob/78debbc2a57885d2f4dce88d51f8c64183f1993d/01-ci/README.md#task-02---unittests-on-native) @riot-ci (see https://github.com/RIOT-OS/Release-Specs/issues/266#issuecomment-1330521336) 
  - [x] [Task #03 - Unittests on native separated](https://github.com/RIOT-OS/Release-Specs/blob/78debbc2a57885d2f4dce88d51f8c64183f1993d/01-ci/README.md#task-03---unittests-on-native-separated) @riot-ci (see https://github.com/RIOT-OS/Release-Specs/issues/266#issuecomment-1330521336) 
  - [x] [Task #04 - Unittests on iotlab-m3](https://github.com/RIOT-OS/Release-Specs/blob/78debbc2a57885d2f4dce88d51f8c64183f1993d/01-ci/README.md#task-04---unittests-on-iotlab-m3) @riot-ci (see https://github.com/RIOT-OS/Release-Specs/issues/266#issuecomment-1330521336) 
- [x] [02-tests](https://github.com/RIOT-OS/Release-Specs/blob/78debbc2a57885d2f4dce88d51f8c64183f1993d/02-tests/README.md)
  - [x] [Task #01 - All tests on native](https://github.com/RIOT-OS/Release-Specs/blob/78debbc2a57885d2f4dce88d51f8c64183f1993d/02-tests/README.md#task-01---all-tests-on-native) @maribu (see https://github.com/RIOT-OS/Release-Specs/issues/266#issuecomment-1330995747)
  - [x] [Task #02 - Subset of tests on iotlab-m3](https://github.com/RIOT-OS/Release-Specs/blob/78debbc2a57885d2f4dce88d51f8c64183f1993d/02-tests/README.md#task-02---subset-of-tests-on-iotlab-m3) @riot-ci https://github.com/RIOT-OS/RIOT/actions/runs/3573833514/jobs/6008361127
  - [x] [Task #03 - Subset of tests on samr21-xpro](https://github.com/RIOT-OS/Release-Specs/blob/78debbc2a57885d2f4dce88d51f8c64183f1993d/02-tests/README.md#task-03---subset-of-tests-on-samr21-xpro) @maribu (see https://github.com/maribu/riot-test-results/tree/main/2022.10-branch-e251312aeaed93b2a8c09b1978152c92ee5a8c1d/samr21-xpro)
- [x] [03-single-hop-ipv6-icmp](https://github.com/RIOT-OS/Release-Specs/blob/78debbc2a57885d2f4dce88d51f8c64183f1993d/03-single-hop-ipv6-icmp/README.md)
  - [x] [Task #01 - ICMPv6 multicast echo on native](https://github.com/RIOT-OS/Release-Specs/blob/78debbc2a57885d2f4dce88d51f8c64183f1993d/03-single-hop-ipv6-icmp/README.md#task-01---icmpv6-multicast-echo-on-native) @riot-ci (see https://github.com/RIOT-OS/Release-Specs/issues/266#issuecomment-1330521336) 
  - [x] [Task #02 - ICMPv6 link-local echo on native](https://github.com/RIOT-OS/Release-Specs/blob/78debbc2a57885d2f4dce88d51f8c64183f1993d/03-single-hop-ipv6-icmp/README.md#task-02---icmpv6-link-local-echo-on-native) @riot-ci (see https://github.com/RIOT-OS/Release-Specs/issues/266#issuecomment-1330521336) 
  - [x] [Task #03 - ICMPv6 link-local echo on native (1 hour)](https://github.com/RIOT-OS/Release-Specs/blob/78debbc2a57885d2f4dce88d51f8c64183f1993d/03-single-hop-ipv6-icmp/README.md#task-03---icmpv6-link-local-echo-on-native-1-hour) @riot-ci (see https://github.com/RIOT-OS/Release-Specs/issues/266#issuecomment-1330521336) 
  - [x] [Task #04 - ICMPv6 stress test on native (1 hour)](https://github.com/RIOT-OS/Release-Specs/blob/78debbc2a57885d2f4dce88d51f8c64183f1993d/03-single-hop-ipv6-icmp/README.md#task-04---icmpv6-stress-test-on-native-1-hour) @riot-ci (see https://github.com/RIOT-OS/Release-Specs/issues/266#issuecomment-1330521336) 
  - [x] [Task #05 - ICMPv6 stress test on native (neighbor cache stress)](https://github.com/RIOT-OS/Release-Specs/blob/78debbc2a57885d2f4dce88d51f8c64183f1993d/03-single-hop-ipv6-icmp/README.md#task-05---icmpv6-stress-test-on-native-neighbor-cache-stress) @riot-ci (see https://github.com/RIOT-OS/Release-Specs/issues/266#issuecomment-1330521336) 
  - [x] [Task #06 - ICMPv6 link-local echo on native (IPv6 fragmentation)](https://github.com/RIOT-OS/Release-Specs/blob/78debbc2a57885d2f4dce88d51f8c64183f1993d/03-single-hop-ipv6-icmp/README.md#task-06---icmpv6-link-local-echo-on-native-ipv6-fragmentation) @riot-ci (see https://github.com/RIOT-OS/Release-Specs/issues/266#issuecomment-1330521336) 
- [ ] [04-single-hop-6lowpan-icmp](https://github.com/RIOT-OS/Release-Specs/blob/78debbc2a57885d2f4dce88d51f8c64183f1993d/04-single-hop-6lowpan-icmp/README.md)
  - [x] [Task #01 - ICMPv6 link-local echo with iotlab-m3](https://github.com/RIOT-OS/Release-Specs/blob/78debbc2a57885d2f4dce88d51f8c64183f1993d/04-single-hop-6lowpan-icmp/README.md#task-01---icmpv6-link-local-echo-with-iotlab-m3) @riot-ci (see https://github.com/RIOT-OS/Release-Specs/issues/266#issuecomment-1330521336) 
  - [x] [Task #02 - ICMPv6 multicast echo with iotlab-m3/samr21-xpro](https://github.com/RIOT-OS/Release-Specs/blob/78debbc2a57885d2f4dce88d51f8c64183f1993d/04-single-hop-6lowpan-icmp/README.md#task-02---icmpv6-multicast-echo-with-iotlab-m3samr21-xpro) @riot-ci (see https://github.com/RIOT-OS/Release-Specs/issues/266#issuecomment-1330521336) 
  - [x] [Task #03 - ICMPv6 echo with large payload](https://github.com/RIOT-OS/Release-Specs/blob/78debbc2a57885d2f4dce88d51f8c64183f1993d/04-single-hop-6lowpan-icmp/README.md#task-03---icmpv6-echo-with-large-payload) @riot-ci (see https://github.com/RIOT-OS/Release-Specs/issues/266#issuecomment-1330521336) 
  - [x] [Task #04 - ICMPv6 echo with iotlab-m3/samr21-xpro 15 minutes](https://github.com/RIOT-OS/Release-Specs/blob/78debbc2a57885d2f4dce88d51f8c64183f1993d/04-single-hop-6lowpan-icmp/README.md#task-04---icmpv6-echo-with-iotlab-m3samr21-xpro-15-minutes) @riot-ci (see https://github.com/RIOT-OS/Release-Specs/issues/266#issuecomment-1330521336) 
  - [ ] [Task #05 (Experimental) - ICMPv6 multicast echo with samr21-xpro/cc2538](https://github.com/RIOT-OS/Release-Specs/blob/78debbc2a57885d2f4dce88d51f8c64183f1993d/04-single-hop-6lowpan-icmp/README.md#task-05-experimental---icmpv6-multicast-echo-with-samr21-xprocc2538)
  - [ ] [Task #06 (Experimental)- ICMPv6 link-local echo with samr21-xpro/cc2538](https://github.com/RIOT-OS/Release-Specs/blob/78debbc2a57885d2f4dce88d51f8c64183f1993d/04-single-hop-6lowpan-icmp/README.md#task-06-experimental---icmpv6-link-local-echo-with-samr21-xprocc2538)
  - [ ] [Task #07 (Experimental) - ICMPv6 multicast echo with samr21-xpro/zero + xbee](https://github.com/RIOT-OS/Release-Specs/blob/78debbc2a57885d2f4dce88d51f8c64183f1993d/04-single-hop-6lowpan-icmp/README.md#task-07-experimental---icmpv6-multicast-echo-with-samr21-xprozero--xbee)
  - [ ] [Task #08 (Experimental) - ICMPv6 echo with samr21-xpro/zero + xbee](https://github.com/RIOT-OS/Release-Specs/blob/78debbc2a57885d2f4dce88d51f8c64183f1993d/04-single-hop-6lowpan-icmp/README.md#task-08-experimental---icmpv6-echo-with-samr21-xprozero--xbee)
  - [x] [Task #09 - ICMPv6 stress test on iotlab-m3](https://github.com/RIOT-OS/Release-Specs/blob/78debbc2a57885d2f4dce88d51f8c64183f1993d/04-single-hop-6lowpan-icmp/README.md#task-09---icmpv6-stress-test-on-iotlab-m3) @riot-ci (see https://github.com/RIOT-OS/Release-Specs/issues/266#issuecomment-1330521336) 
  - [x] [Task #10 (Experimental) - ICMPv6 echo with large payload (IPv6 fragmentation)](https://github.com/RIOT-OS/Release-Specs/blob/78debbc2a57885d2f4dce88d51f8c64183f1993d/04-single-hop-6lowpan-icmp/README.md#task-10-experimental---icmpv6-echo-with-large-payload-ipv6-fragmentation) @riot-ci (see https://github.com/RIOT-OS/Release-Specs/issues/266#issuecomment-1330521336) 
  - [x] [Task #11 (Experimental) - ICMPv6 stress test on nrf802154](https://github.com/RIOT-OS/Release-Specs/blob/78debbc2a57885d2f4dce88d51f8c64183f1993d/04-single-hop-6lowpan-icmp/README.md#task-11-experimental---icmpv6-stress-test-on-nrf802154) @riot-ci (see https://github.com/RIOT-OS/Release-Specs/issues/266#issuecomment-1330521336) 
  - [x] [Task #12 (Experimental) - ICMPv6 multicast echo with iotlab-m3/nrf802154](https://github.com/RIOT-OS/Release-Specs/blob/78debbc2a57885d2f4dce88d51f8c64183f1993d/04-single-hop-6lowpan-icmp/README.md#task-12-experimental---icmpv6-multicast-echo-with-iotlab-m3nrf802154) @riot-ci (see https://github.com/RIOT-OS/Release-Specs/issues/266#issuecomment-1330521336) 
  - [x] [Task #13 (Experimental) - ICMPv6 link-local echo with iotlab-m3/nrf802154](https://github.com/RIOT-OS/Release-Specs/blob/78debbc2a57885d2f4dce88d51f8c64183f1993d/04-single-hop-6lowpan-icmp/README.md#task-13-experimental---icmpv6-link-local-echo-with-iotlab-m3nrf802154) @riot-ci (see https://github.com/RIOT-OS/Release-Specs/issues/266#issuecomment-1330521336) 
- [x] [05-single-hop-route](https://github.com/RIOT-OS/Release-Specs/blob/78debbc2a57885d2f4dce88d51f8c64183f1993d/05-single-hop-route/README.md)
  - [x] [Task #01 - ICMPv6 echo unicast addresess on native (default route)](https://github.com/RIOT-OS/Release-Specs/blob/78debbc2a57885d2f4dce88d51f8c64183f1993d/05-single-hop-route/README.md#task-01---icmpv6-echo-unicast-addresess-on-native-default-route) @riot-ci (see https://github.com/RIOT-OS/Release-Specs/issues/266#issuecomment-1330521336) 
  - [x] [Task #02 - ICMPv6 echo unicast addresess on iotlab-m3 (default route)](https://github.com/RIOT-OS/Release-Specs/blob/78debbc2a57885d2f4dce88d51f8c64183f1993d/05-single-hop-route/README.md#task-02---icmpv6-echo-unicast-addresess-on-iotlab-m3-default-route) @riot-ci (see https://github.com/RIOT-OS/Release-Specs/issues/266#issuecomment-1330521336) 
  - [x] [Task #03 - ICMPv6 echo unicast addresess on native (specific route)](https://github.com/RIOT-OS/Release-Specs/blob/78debbc2a57885d2f4dce88d51f8c64183f1993d/05-single-hop-route/README.md#task-03---icmpv6-echo-unicast-addresess-on-native-specific-route) @riot-ci (see https://github.com/RIOT-OS/Release-Specs/issues/266#issuecomment-1330521336) 
  - [x] [Task #04 - ICMPv6 echo unicast addresess on iotlab-m3 (static route)](https://github.com/RIOT-OS/Release-Specs/blob/78debbc2a57885d2f4dce88d51f8c64183f1993d/05-single-hop-route/README.md#task-04---icmpv6-echo-unicast-addresess-on-iotlab-m3-static-route) @riot-ci (see https://github.com/RIOT-OS/Release-Specs/issues/266#issuecomment-1330521336) 
- [x] [06-single-hop-udp](https://github.com/RIOT-OS/Release-Specs/blob/78debbc2a57885d2f4dce88d51f8c64183f1993d/06-single-hop-udp/README.md)
  - [x] [Task #01 - UDP on iotlab-m3](https://github.com/RIOT-OS/Release-Specs/blob/78debbc2a57885d2f4dce88d51f8c64183f1993d/06-single-hop-udp/README.md#task-01---udp-on-iotlab-m3) @riot-ci (see https://github.com/RIOT-OS/Release-Specs/issues/266#issuecomment-1330521336) 
  - [x] [Task #02 - UDP on iotlab-m3 (UDP port compression)](https://github.com/RIOT-OS/Release-Specs/blob/78debbc2a57885d2f4dce88d51f8c64183f1993d/06-single-hop-udp/README.md#task-02---udp-on-iotlab-m3-udp-port-compression) @riot-ci (see https://github.com/RIOT-OS/Release-Specs/issues/266#issuecomment-1330521336) 
  - [x] [Task #03 - UDP on native (non-existent neighbor)](https://github.com/RIOT-OS/Release-Specs/blob/78debbc2a57885d2f4dce88d51f8c64183f1993d/06-single-hop-udp/README.md#task-03---udp-on-native-non-existent-neighbor) @riot-ci (see https://github.com/RIOT-OS/Release-Specs/issues/266#issuecomment-1330521336) 
  - [x] [Task #04 - UDP on iotlab-m3 (non-existent neighbor)](https://github.com/RIOT-OS/Release-Specs/blob/78debbc2a57885d2f4dce88d51f8c64183f1993d/06-single-hop-udp/README.md#task-04---udp-on-iotlab-m3-non-existent-neighbor) @riot-ci (see https://github.com/RIOT-OS/Release-Specs/issues/266#issuecomment-1330521336) 
  - [x] [Task #05 - Empty UDP on native](https://github.com/RIOT-OS/Release-Specs/blob/78debbc2a57885d2f4dce88d51f8c64183f1993d/06-single-hop-udp/README.md#task-05---empty-udp-on-native) @riot-ci (see https://github.com/RIOT-OS/Release-Specs/issues/266#issuecomment-1330521336) 
  - [x] [Task #06 - Empty UDP on iotlab-m3](https://github.com/RIOT-OS/Release-Specs/blob/78debbc2a57885d2f4dce88d51f8c64183f1993d/06-single-hop-udp/README.md#task-06---empty-udp-on-iotlab-m3) @riot-ci (see https://github.com/RIOT-OS/Release-Specs/issues/266#issuecomment-1330521336) 
- [ ] [07-multi-hop](https://github.com/RIOT-OS/Release-Specs/blob/78debbc2a57885d2f4dce88d51f8c64183f1993d/07-multi-hop/README.md)
  - [x] [Task #01 - ICMPv6 echo on iotlab-m3 with three hops (static route)](https://github.com/RIOT-OS/Release-Specs/blob/78debbc2a57885d2f4dce88d51f8c64183f1993d/07-multi-hop/README.md#task-01---icmpv6-echo-on-iotlab-m3-with-three-hops-static-route) @riot-ci (see https://github.com/RIOT-OS/Release-Specs/issues/266#issuecomment-1330521336) 
  - [x] [Task #02 - UDP on iotlab-m3 with three hops (static route)](https://github.com/RIOT-OS/Release-Specs/blob/78debbc2a57885d2f4dce88d51f8c64183f1993d/07-multi-hop/README.md#task-02---udp-on-iotlab-m3-with-three-hops-static-route) @riot-ci (see https://github.com/RIOT-OS/Release-Specs/issues/266#issuecomment-1330521336) 
  - [x] [Task #03 - ICMPv6 echo on iotlab-m3 with three hops (RPL route)](https://github.com/RIOT-OS/Release-Specs/blob/78debbc2a57885d2f4dce88d51f8c64183f1993d/07-multi-hop/README.md#task-03---icmpv6-echo-on-iotlab-m3-with-three-hops-rpl-route) @riot-ci (see https://github.com/RIOT-OS/Release-Specs/issues/266#issuecomment-1330521336) 
  - [x] [Task #04 - UDP on iotlab-m3 with three hops (RPL route)](https://github.com/RIOT-OS/Release-Specs/blob/78debbc2a57885d2f4dce88d51f8c64183f1993d/07-multi-hop/README.md#task-04---udp-on-iotlab-m3-with-three-hops-rpl-route) @riot-ci (see https://github.com/RIOT-OS/Release-Specs/issues/266#issuecomment-1330521336) 
  - [ ] [Task #05 (Experimental) - UDP with large payload on iotlab-m3 with three hops (RPL route)](https://github.com/RIOT-OS/Release-Specs/blob/78debbc2a57885d2f4dce88d51f8c64183f1993d/07-multi-hop/README.md#task-05-experimental---udp-with-large-payload-on-iotlab-m3-with-three-hops-rpl-route)
- [ ] [08-interop](https://github.com/RIOT-OS/Release-Specs/blob/78debbc2a57885d2f4dce88d51f8c64183f1993d/08-interop/README.md)
  - [x] [Task #01 - ICMPv6 echo between native and Linux](https://github.com/RIOT-OS/Release-Specs/blob/78debbc2a57885d2f4dce88d51f8c64183f1993d/08-interop/README.md#task-01---icmpv6-echo-between-native-and-linux) @riot-ci (see https://github.com/RIOT-OS/Release-Specs/issues/266#issuecomment-1330521336) 
  - [ ] [Task #02 - ICMPv6 echo between iotlab-m3 and Linux with 6LowPAN](https://github.com/RIOT-OS/Release-Specs/blob/78debbc2a57885d2f4dce88d51f8c64183f1993d/08-interop/README.md#task-02---icmpv6-echo-between-iotlab-m3-and-linux-with-6lowpan)
  - [x] [Task #03 - UDP exchange between iotlab-m3 and Contiki](https://github.com/RIOT-OS/Release-Specs/blob/78debbc2a57885d2f4dce88d51f8c64183f1993d/08-interop/README.md#task-03---udp-exchange-between-iotlab-m3-and-contiki) (see https://github.com/RIOT-OS/Release-Specs/issues/264#issuecomment-1302117849)
  - [ ] [Task #04 - ICMPv6 echo between iotlab-m3 and Internet host through Linux with 6LowPAN](https://github.com/RIOT-OS/Release-Specs/blob/78debbc2a57885d2f4dce88d51f8c64183f1993d/08-interop/README.md#task-04---icmpv6-echo-between-iotlab-m3-and-internet-host-through-linux-with-6lowpan)
  - [x] [Task #05 - ICMPv6 echo between iotlab-m3 and Internet host through RIOT border router](https://github.com/RIOT-OS/Release-Specs/blob/78debbc2a57885d2f4dce88d51f8c64183f1993d/08-interop/README.md#task-05---icmpv6-echo-between-iotlab-m3-and-internet-host-through-riot-border-router) (see https://github.com/RIOT-OS/Release-Specs/issues/266#issuecomment-1333958801)
  - [x] [Task #06 - UDP between iotlab-m3 and Internet host through RIOT border router](https://github.com/RIOT-OS/Release-Specs/blob/78debbc2a57885d2f4dce88d51f8c64183f1993d/08-interop/README.md#task-06---udp-between-iotlab-m3-and-internet-host-through-riot-border-router) (see https://github.com/RIOT-OS/Release-Specs/issues/266#issuecomment-1333958801)
  - [x] [Task #07 - UDP between iotlab-m3 and Internet host through RIOT border router (200b payload)](https://github.com/RIOT-OS/Release-Specs/blob/78debbc2a57885d2f4dce88d51f8c64183f1993d/08-interop/README.md#task-07---udp-between-iotlab-m3-and-internet-host-through-riot-border-router-200b-payload) (see https://github.com/RIOT-OS/Release-Specs/issues/266#issuecomment-1333958801)
  - [x] [Task #08 - UDP between GNRC and lwIP on iotlab-m3](https://github.com/RIOT-OS/Release-Specs/blob/78debbc2a57885d2f4dce88d51f8c64183f1993d/08-interop/README.md#task-08---udp-between-gnrc-and-lwip-on-iotlab-m3) @riot-ci (see https://github.com/RIOT-OS/Release-Specs/issues/266#issuecomment-1330521336) 
  - [x] [Task #11 - UDP exchange between iotlab-m3 and Zephyr](https://github.com/RIOT-OS/Release-Specs/blob/78debbc2a57885d2f4dce88d51f8c64183f1993d/08-interop/README.md#task-11---udp-exchange-between-iotlab-m3-and-zephyr)
  - [x] [Task #12 - ICMPv6 echo between Border Router with WiFi uplink to named Internet host](https://github.com/RIOT-OS/Release-Specs/blob/78debbc2a57885d2f4dce88d51f8c64183f1993d/08-interop/README.md#task-12---icmpv6-echo-between-border-router-with-wifi-uplink-to-named-internet-host)
  - [x] [Task #13 - ICMPv6 echo between ESP and named Internet host through Linux with 6LowPAN](https://github.com/RIOT-OS/Release-Specs/blob/78debbc2a57885d2f4dce88d51f8c64183f1993d/08-interop/README.md#task-13---icmpv6-echo-between-esp-and-named-internet-host-through-linux-with-6lowpan)
- [x] [09-coap](https://github.com/RIOT-OS/Release-Specs/blob/78debbc2a57885d2f4dce88d51f8c64183f1993d/09-coap/README.md)
  - [x] [Task #01 - CORD Endpoint](https://github.com/RIOT-OS/Release-Specs/blob/78debbc2a57885d2f4dce88d51f8c64183f1993d/09-coap/README.md#task-01---cord-endpoint) @riot-ci (see https://github.com/RIOT-OS/Release-Specs/issues/266#issuecomment-1330521336) 
  - [x] [Task #02 - Confirmable retries](https://github.com/RIOT-OS/Release-Specs/blob/78debbc2a57885d2f4dce88d51f8c64183f1993d/09-coap/README.md#task-02---confirmable-retries) @riot-ci (see https://github.com/RIOT-OS/Release-Specs/issues/266#issuecomment-1330521336) 
  - [x] [Task #03 - Block1](https://github.com/RIOT-OS/Release-Specs/blob/78debbc2a57885d2f4dce88d51f8c64183f1993d/09-coap/README.md#task-03---block1) @riot-ci (see https://github.com/RIOT-OS/Release-Specs/issues/266#issuecomment-1330521336) 
  - [x] [Task #04 - Block2](https://github.com/RIOT-OS/Release-Specs/blob/78debbc2a57885d2f4dce88d51f8c64183f1993d/09-coap/README.md#task-04---block2) @riot-ci (see https://github.com/RIOT-OS/Release-Specs/issues/266#issuecomment-1330521336) 
  - [x] [Task #05 - Observe registration and notification](https://github.com/RIOT-OS/Release-Specs/blob/78debbc2a57885d2f4dce88d51f8c64183f1993d/09-coap/README.md#task-05---observe-registration-and-notification) @riot-ci (see https://github.com/RIOT-OS/Release-Specs/issues/266#issuecomment-1330521336) 
- [x] [10-icmpv6-error](https://github.com/RIOT-OS/Release-Specs/blob/78debbc2a57885d2f4dce88d51f8c64183f1993d/10-icmpv6-error/README.md)
  - [x] [Task #01 - Destination unreachable - no route to destination](https://github.com/RIOT-OS/Release-Specs/blob/78debbc2a57885d2f4dce88d51f8c64183f1993d/10-icmpv6-error/README.md#task-01---destination-unreachable---no-route-to-destination) @riot-ci (see https://github.com/RIOT-OS/Release-Specs/issues/266#issuecomment-1330521336) 
  - [x] [Task #02 - Destination unreachable - Beyond scope of source address](https://github.com/RIOT-OS/Release-Specs/blob/78debbc2a57885d2f4dce88d51f8c64183f1993d/10-icmpv6-error/README.md#task-02---destination-unreachable---beyond-scope-of-source-address) @riot-ci (see https://github.com/RIOT-OS/Release-Specs/issues/266#issuecomment-1330521336) 
  - [x] [Task #03 - Destination unreachable - address unreachable (target node address)](https://github.com/RIOT-OS/Release-Specs/blob/78debbc2a57885d2f4dce88d51f8c64183f1993d/10-icmpv6-error/README.md#task-03---destination-unreachable---address-unreachable-target-node-address) @riot-ci (see https://github.com/RIOT-OS/Release-Specs/issues/266#issuecomment-1330521336) 
  - [x] [Task #04 - Destination unreachable - address unreachable (neighbor cache miss)](https://github.com/RIOT-OS/Release-Specs/blob/78debbc2a57885d2f4dce88d51f8c64183f1993d/10-icmpv6-error/README.md#task-04---destination-unreachable---address-unreachable-neighbor-cache-miss) @riot-ci (see https://github.com/RIOT-OS/Release-Specs/issues/266#issuecomment-1330521336) 
  - [x] [Task #05 - Destination unreachable - port unreachable](https://github.com/RIOT-OS/Release-Specs/blob/78debbc2a57885d2f4dce88d51f8c64183f1993d/10-icmpv6-error/README.md#task-05---destination-unreachable---port-unreachable) @riot-ci (see https://github.com/RIOT-OS/Release-Specs/issues/266#issuecomment-1330521336) 
  - [x] [Task #06 - Destination unreachable - port unreachable (large payload)](https://github.com/RIOT-OS/Release-Specs/blob/78debbc2a57885d2f4dce88d51f8c64183f1993d/10-icmpv6-error/README.md#task-06---destination-unreachable---port-unreachable-large-payload) @riot-ci (see https://github.com/RIOT-OS/Release-Specs/issues/266#issuecomment-1330521336) 
  - [x] [Task #07 - Packet too big](https://github.com/RIOT-OS/Release-Specs/blob/78debbc2a57885d2f4dce88d51f8c64183f1993d/10-icmpv6-error/README.md#task-07---packet-too-big) @riot-ci (see https://github.com/RIOT-OS/Release-Specs/issues/266#issuecomment-1330521336) 
  - [x] [Task #08 - Time exceeded - hop limit exceeded in transit](https://github.com/RIOT-OS/Release-Specs/blob/78debbc2a57885d2f4dce88d51f8c64183f1993d/10-icmpv6-error/README.md#task-08---time-exceeded---hop-limit-exceeded-in-transit) @riot-ci (see https://github.com/RIOT-OS/Release-Specs/issues/266#issuecomment-1330521336) 
  - [x] [Task #09 - Parameter problem - erroneous header field encountered](https://github.com/RIOT-OS/Release-Specs/blob/78debbc2a57885d2f4dce88d51f8c64183f1993d/10-icmpv6-error/README.md#task-09---parameter-problem---erroneous-header-field-encountered) @riot-ci (see https://github.com/RIOT-OS/Release-Specs/issues/266#issuecomment-1330521336) 
  - [x] [Task #10 - IPv6-in-IPv6 encapsulation](https://github.com/RIOT-OS/Release-Specs/blob/78debbc2a57885d2f4dce88d51f8c64183f1993d/10-icmpv6-error/README.md#task-10---ipv6-in-ipv6-encapsulation) @riot-ci (see https://github.com/RIOT-OS/Release-Specs/issues/266#issuecomment-1330521336) 
- [ ] [11-lorawan](https://github.com/RIOT-OS/Release-Specs/blob/78debbc2a57885d2f4dce88d51f8c64183f1993d/11-lorawan/README.md)
  - [x] [Task #01 - LoRaWAN example](https://github.com/RIOT-OS/Release-Specs/blob/78debbc2a57885d2f4dce88d51f8c64183f1993d/11-lorawan/README.md#task-01---lorawan-example) @riot-ci (see https://github.com/RIOT-OS/Release-Specs/issues/266#issuecomment-1330521336) 
  - [x] [Task #02 - OTAA join procedure](https://github.com/RIOT-OS/Release-Specs/blob/78debbc2a57885d2f4dce88d51f8c64183f1993d/11-lorawan/README.md#task-02---otaa-join-procedure) @riot-ci (see https://github.com/RIOT-OS/Release-Specs/issues/266#issuecomment-1330521336) 
  - [x] [Task #03 - ABP join procedure](https://github.com/RIOT-OS/Release-Specs/blob/78debbc2a57885d2f4dce88d51f8c64183f1993d/11-lorawan/README.md#task-03---abp-join-procedure) @riot-ci (see https://github.com/RIOT-OS/Release-Specs/issues/266#issuecomment-1330521336) 
  - [x] [Task #04 - LoRaWAN device parameters persistence](https://github.com/RIOT-OS/Release-Specs/blob/78debbc2a57885d2f4dce88d51f8c64183f1993d/11-lorawan/README.md#task-04---lorawan-device-parameters-persistence) @riot-ci (see https://github.com/RIOT-OS/Release-Specs/issues/266#issuecomment-1330521336) 
  - [x] [Task #05 - GNRC LoRaWAN (Over The Air Activation)](https://github.com/RIOT-OS/Release-Specs/blob/78debbc2a57885d2f4dce88d51f8c64183f1993d/11-lorawan/README.md#task-05---gnrc-lorawan-over-the-air-activation) @riot-ci (see https://github.com/RIOT-OS/Release-Specs/issues/266#issuecomment-1330521336) 
  - [ ] [Task #06 - GNRC LoRaWAN (ABP)](https://github.com/RIOT-OS/Release-Specs/blob/78debbc2a57885d2f4dce88d51f8c64183f1993d/11-lorawan/README.md#task-06---gnrc-lorawan-abp)
- [x] [99-compile-and-test-one-board](https://github.com/RIOT-OS/Release-Specs/blob/78debbc2a57885d2f4dce88d51f8c64183f1993d/99-compile-and-test-one-board/README.md)
  - [x] [Task #01 - Run tests on different hardwares](https://github.com/RIOT-OS/Release-Specs/blob/78debbc2a57885d2f4dce88d51f8c64183f1993d/99-compile-and-test-one-board/README.md#task-01---run-tests-on-different-hardwares) @maribu (see https://github.com/RIOT-OS/Release-Specs/issues/266#issuecomment-1330995747)

**Comment by maribu** [comment]
IMO https://github.com/RIOT-OS/Release-Specs/issues/264#issuecomment-1313571914 is still valid, as the changes since RC2 have a close to zero chance to break things. I ticked task 8.11 therefore.

**Comment by leandrolanzieri** [comment]
Regarding the remaining Linux interop tests, I think @jia200x was going to give them a try

**Comment by maribu** [comment]
# `compile_and_test_for_board.py`

## `nrf52840dk`

Failures during test:
- [tests/periph_timer_short_relative_set](https://github.com/maribu/riot-test-results/blob/main/2022.10-branch-e251312aeaed93b2a8c09b1978152c92ee5a8c1d/nrf52840dk/tests/periph_timer_short_relative_set/test.failed)

## `nucleo-f767zi`

Failures during test:
- [tests/periph_timer_short_relative_set](https://github.com/maribu/riot-test-results/blob/main/2022.10-branch-e251312aeaed93b2a8c09b1978152c92ee5a8c1d/nucleo-f767zi/tests/periph_timer_short_relative_set/test.failed)

Failures during test.flash:
- [tests/riotboot](https://github.com/maribu/riot-test-results/blob/main/2022.10-branch-e251312aeaed93b2a8c09b1978152c92ee5a8c1d/nucleo-f767zi/tests/riotboot/test.flash.failed)

## `samr21-xpro`

Failures during test:
- ~~[examples/micropython](https://github.com/maribu/riot-test-results/blob/main/2022.10-branch-e251312aeaed93b2a8c09b1978152c92ee5a8c1d/samr21-xpro/examples/micropython/test.failed)~~
    - This test is flaky on the `samr21-xpro`. It passes when pressing manually reset just after running `make test`, but fails reliably without the manual reset.
- [tests/periph_timer_short_relative_set](https://github.com/maribu/riot-test-results/blob/main/2022.10-branch-e251312aeaed93b2a8c09b1978152c92ee5a8c1d/samr21-xpro/tests/periph_timer_short_relative_set/test.failed)

**Comment by kaspar030** [comment]
> * [examples/rust-gcoap](https://github.com/maribu/riot-test-results/blob/main/2022.10-branch-e251312aeaed93b2a8c09b1978152c92ee5a8c1d/native/examples/rust-gcoap/compilation.failed)
>   
>   * this is unexpected
> 
> * [tests/pkg_nanopb](https://github.com/maribu/riot-test-results/blob/main/2022.10-branch-e251312aeaed93b2a8c09b1978152c92ee5a8c1d/native/tests/pkg_nanopb/compilation.failed)
>   
>   * and so is this

these two are build environment errors - which system was this built on?

**Comment by maribu** [comment]
> these two are build environment errors - which system was this built on?

I manually launched `riot/riotbuild`. It should basically yield the same result as in Murdock.

**Comment by maribu** [comment]
# 08-Interop

## Task 12

```
2022-12-01 01:06:55,856 # ets Jun  8 2016 00:22:57
2022-12-01 01:06:55,856 # 
2022-12-01 01:06:55,857 # rst:0x1 (POWERON_RESET),boot:0x13 (SPI_FAST_FLASH_BOOT)
2022-12-01 01:06:55,858 # configsip: 0, SPIWP:0xee
2022-12-01 01:06:55,859 # clk_drv:0x00,q_drv:0x00,d_drv:0x00,cs0_drv:0x00,hd_drv:0x00,wp_drv:0x00
2022-12-01 01:06:55,860 # mode:DOUT, clock div:2
2022-12-01 01:06:55,861 # load:0x3fff0030,len:1472
2022-12-01 01:06:55,861 # load:0x40078000,len:12788
2022-12-01 01:06:55,862 # ho 0 tail 12 room 4
2022-12-01 01:06:55,862 # load:0x40080400,len:2848
2022-12-01 01:06:55,863 # entry 0x40080410
2022-12-01 01:06:56,054 # Pro cpu up.
2022-12-01 01:06:56,055 # Single core mode
2022-12-01 01:06:56,132 # Initializing. RAM available for dynamic allocation:
2022-12-01 01:06:56,133 # At 3FFAE6E0 len 00001920 (6 KiB): DRAM
2022-12-01 01:06:56,134 # At 3FFBDCE0 len 00022320 (136 KiB): DRAM
2022-12-01 01:06:56,135 # At 3FFE0440 len 0001FBC0 (126 KiB): D/IRAM
2022-12-01 01:06:56,136 # At 40078000 len 00008000 (32 KiB): IRAM
2022-12-01 01:06:56,136 # At 4008F930 len 000106D0 (65 KiB): IRAM
2022-12-01 01:06:56,137 # 
2022-12-01 01:06:58,043 # DHCPv6: Selecting interface 10 as upstream
2022-12-01 01:06:58,044 # DHCPv6: Selecting interface 10 as upstream
2022-12-01 01:06:58,045 # main(): This is RIOT! (Version: 2023.01-devel-84-ge2513-2022.10-branch)
2022-12-01 01:06:58,046 # RIOT border router example application
2022-12-01 01:06:58,047 # All up, running the shell now
> 2022-12-01 01:07:02,218 # WiFi connected to ssid Loeffelnetz, channel 11
ifconfig
2022-12-01 01:07:03,516 # ifconfig
2022-12-01 01:07:03,517 # Iface  9  HWaddr: A4:CF:12:44:E8:15  Channel: 11 
2022-12-01 01:07:03,518 #           L2-PDU:249  MTU:1280  HL:64  RTR  
2022-12-01 01:07:03,519 #           6LO  Source address length: 6
2022-12-01 01:07:03,520 #           Link type: wireless
2022-12-01 01:07:03,521 #           inet6 addr: fe80::a6cf:12ff:fe44:e815  scope: link  VAL
2022-12-01 01:07:03,537 #           inet6 group: ff02::2
2022-12-01 01:07:03,538 #           inet6 group: ff02::1
2022-12-01 01:07:03,539 #           inet6 group: ff02::1:ff44:e815
2022-12-01 01:07:03,539 #           
2022-12-01 01:07:03,540 # Iface  10  HWaddr: A4:CF:12:44:E8:14  Channel: 11  Link: up 
2022-12-01 01:07:03,541 #           L2-PDU:1500  MTU:1492  HL:255  RTR  
2022-12-01 01:07:03,542 #           Source address length: 6
2022-12-01 01:07:03,560 #           Link type: wireless
2022-12-01 01:07:03,561 #           inet6 addr: fe80::a6cf:12ff:fe44:e814  scope: link  VAL
2022-12-01 01:07:03,562 #           inet6 addr: 2a01:c22:adcf:7300:a6cf:12ff:fe44:e814  scope: global  TNT[1]
2022-12-01 01:07:03,563 #           inet6 group: ff02::2
2022-12-01 01:07:03,563 #           inet6 group: ff02::1
2022-12-01 01:07:03,564 #           inet6 group: ff02::1:ff44:e814
2022-12-01 01:07:03,565 #           
> ping 2001:4d88:3508::fefe:b106
2022-12-01 01:07:14,558 # ping 2001:4d88:3508::fefe:b106
2022-12-01 01:07:14,607 # 12 bytes from 2001:4d88:3508::fefe:b106: icmp_seq=0 ttl=55 time=43.163 ms
2022-12-01 01:07:15,603 # 12 bytes from 2001:4d88:3508::fefe:b106: icmp_seq=1 ttl=55 time=39.769 ms
2022-12-01 01:07:16,617 # 12 bytes from 2001:4d88:3508::fefe:b106: icmp_seq=2 ttl=55 time=39.777 ms
2022-12-01 01:07:16,617 # 
2022-12-01 01:07:16,618 # --- 2001:4d88:3508::fefe:b106 PING statistics ---
2022-12-01 01:07:16,619 # 3 packets transmitted, 3 packets received, 0% packet loss
2022-12-01 01:07:16,620 # round-trip min/avg/max = 39.769/40.903/43.163 ms
> ping riot-os.org
2022-12-01 01:07:19,816 # ping riot-os.org
2022-12-01 01:07:19,981 # 12 bytes from 2001:67c:254:b0b0::1: icmp_seq=0 ttl=58 time=154.417 ms
2022-12-01 01:07:20,882 # 12 bytes from 2001:67c:254:b0b0::1: icmp_seq=1 ttl=58 time=55.507 ms
2022-12-01 01:07:22,037 # 12 bytes from 2001:67c:254:b0b0::1: icmp_seq=2 ttl=58 time=197.862 ms
2022-12-01 01:07:22,037 # 
2022-12-01 01:07:22,038 # --- riot-os.org PING statistics ---
2022-12-01 01:07:22,039 # 3 packets transmitted, 3 packets received, 0% packet loss
2022-12-01 01:07:22,040 # round-trip min/avg/max = 55.507/135.928/197.862 ms
```

==> ***SUCCESS***

## Task 13

```
2022-12-01 01:06:45,570 # ets Jun  8 2016 00:22:57
2022-12-01 01:06:45,570 # 
2022-12-01 01:06:45,572 # rst:0x1 (POWERON_RESET),boot:0x13 (SPI_FAST_FLASH_BOOT)
2022-12-01 01:06:45,572 # configsip: 0, SPIWP:0xee
2022-12-01 01:06:45,573 # clk_drv:0x00,q_drv:0x00,d_drv:0x00,cs0_drv:0x00,hd_drv:0x00,wp_drv:0x00
2022-12-01 01:06:45,574 # mode:DOUT, clock div:2
2022-12-01 01:06:45,574 # load:0x3fff0030,len:1472
2022-12-01 01:06:45,575 # load:0x40078000,len:12788
2022-12-01 01:06:45,575 # ho 0 tail 12 room 4
2022-12-01 01:06:45,576 # load:0x40080400,len:2848
2022-12-01 01:06:45,576 # entry 0x40080410
2022-12-01 01:06:45,771 # Pro cpu up.
2022-12-01 01:06:45,771 # Single core mode
2022-12-01 01:06:45,848 # Initializing. RAM available for dynamic allocation:
2022-12-01 01:06:45,849 # At 3FFAE6E0 len 00001920 (6 KiB): DRAM
2022-12-01 01:06:45,850 # At 3FFBC668 len 00023998 (142 KiB): DRAM
2022-12-01 01:06:45,851 # At 3FFE0440 len 0001FBC0 (126 KiB): D/IRAM
2022-12-01 01:06:45,852 # At 40078000 len 00008000 (32 KiB): IRAM
2022-12-01 01:06:45,852 # At 4008F78C len 00010874 (66 KiB): IRAM
2022-12-01 01:06:45,852 # 
2022-12-01 01:06:47,755 # NETOPT_TX_END_IRQ not implemented by driver
2022-12-01 01:06:47,756 # main(): This is RIOT! (Version: 2023.01-devel-84-ge2513-2022.10-branch)
2022-12-01 01:06:47,757 # RIOT network stack example application
2022-12-01 01:06:47,757 # All up, running the shell now
> ifconfig
2022-12-01 01:08:11,567 # ifconfig
2022-12-01 01:08:11,568 # Iface  10  HWaddr: A4:CF:12:44:D4:81  Channel: 6 
2022-12-01 01:08:11,569 #           L2-PDU:249  MTU:1280  HL:64  RTR  
2022-12-01 01:08:11,569 #           6LO  Source address length: 6
2022-12-01 01:08:11,570 #           Link type: wireless
2022-12-01 01:08:11,572 #           inet6 addr: fe80::a6cf:12ff:fe44:d481  scope: link  VAL
2022-12-01 01:08:11,589 #           inet6 group: ff02::2
2022-12-01 01:08:11,590 #           inet6 group: ff02::1
2022-12-01 01:08:11,591 #           inet6 group: ff02::1:ff44:d481
2022-12-01 01:08:11,591 #           inet6 group: ff02::1a
2022-12-01 01:08:11,592 #           
2022-12-01 01:08:11,592 #           Statistics for Layer 2
2022-12-01 01:08:11,593 #             RX packets 0  bytes 0
2022-12-01 01:08:11,593 #             TX packets 0 (Multicast: 0)  bytes 0
2022-12-01 01:08:11,605 #             TX succeeded 0 errors 0
2022-12-01 01:08:11,605 #           Statistics for IPv6
2022-12-01 01:08:11,606 #             RX packets 0  bytes 0
2022-12-01 01:08:11,606 #             TX packets 8 (Multicast: 8)  bytes 442
2022-12-01 01:08:11,607 #             TX succeeded 8 errors 0
2022-12-01 01:08:11,607 # 
> ifconfig 10 set channel 11
2022-12-01 01:08:16,594 # ifconfig 10 set channel 11
2022-12-01 01:08:16,605 # success: set channel on interface 10 to 11
> ping fe80::a6cf:12ff:fe44:e815
2022-12-01 01:08:24,597 # ping fe80::a6cf:12ff:fe44:e815
2022-12-01 01:08:24,613 # 12 bytes from fe80::a6cf:12ff:fe44:e815%10: icmp_seq=0 ttl=64 time=7.434 ms
2022-12-01 01:08:25,612 # 12 bytes from fe80::a6cf:12ff:fe44:e815%10: icmp_seq=1 ttl=64 time=6.597 ms
2022-12-01 01:08:26,625 # 12 bytes from fe80::a6cf:12ff:fe44:e815%10: icmp_seq=2 ttl=64 time=6.112 ms
2022-12-01 01:08:26,625 # 
2022-12-01 01:08:26,626 # --- fe80::a6cf:12ff:fe44:e815 PING statistics ---
2022-12-01 01:08:26,627 # 3 packets transmitted, 3 packets received, 0% packet loss
2022-12-01 01:08:26,627 # round-trip min/avg/max = 6.112/6.714/7.434 ms
> ifconfig
2022-12-01 01:08:28,234 # ifconfig
2022-12-01 01:08:28,235 # Iface  10  HWaddr: A4:CF:12:44:D4:81  Channel: 11 
2022-12-01 01:08:28,236 #           L2-PDU:249  MTU:1280  HL:64  RTR  
2022-12-01 01:08:28,237 #           6LO  Source address length: 6
2022-12-01 01:08:28,237 #           Link type: wireless
2022-12-01 01:08:28,238 #           inet6 addr: fe80::a6cf:12ff:fe44:d481  scope: link  VAL
2022-12-01 01:08:28,257 #           inet6 group: ff02::2
2022-12-01 01:08:28,258 #           inet6 group: ff02::1
2022-12-01 01:08:28,259 #           inet6 group: ff02::1:ff44:d481
2022-12-01 01:08:28,259 #           inet6 group: ff02::1a
2022-12-01 01:08:28,259 #           
2022-12-01 01:08:28,260 #           Statistics for Layer 2
2022-12-01 01:08:28,260 #             RX packets 0  bytes 0
2022-12-01 01:08:28,261 #             TX packets 0 (Multicast: 0)  bytes 162
2022-12-01 01:08:28,272 #             TX succeeded 3 errors 0
2022-12-01 01:08:28,273 #           Statistics for IPv6
2022-12-01 01:08:28,273 #             RX packets 4  bytes 212
2022-12-01 01:08:28,274 #             TX packets 11 (Multicast: 8)  bytes 598
2022-12-01 01:08:28,275 #             TX succeeded 11 errors 0
2022-12-01 01:08:28,275 # 
> ifconfig
2022-12-01 01:09:29,596 # ifconfig
2022-12-01 01:09:29,598 # Iface  10  HWaddr: A4:CF:12:44:D4:81  Channel: 11 
2022-12-01 01:09:29,599 #           L2-PDU:249  MTU:1280  HL:64  RTR  
2022-12-01 01:09:29,599 #           6LO  Source address length: 6
2022-12-01 01:09:29,600 #           Link type: wireless
2022-12-01 01:09:29,601 #           inet6 addr: fe80::a6cf:12ff:fe44:d481  scope: link  VAL
2022-12-01 01:09:29,618 #           inet6 group: ff02::2
2022-12-01 01:09:29,619 #           inet6 group: ff02::1
2022-12-01 01:09:29,620 #           inet6 group: ff02::1:ff44:d481
2022-12-01 01:09:29,620 #           inet6 group: ff02::1a
2022-12-01 01:09:29,621 #           
2022-12-01 01:09:29,621 #           Statistics for Layer 2
2022-12-01 01:09:29,622 #             RX packets 0  bytes 0
2022-12-01 01:09:29,622 #             TX packets 0 (Multicast: 0)  bytes 220
2022-12-01 01:09:29,635 #             TX succeeded 4 errors 0
2022-12-01 01:09:29,635 #           Statistics for IPv6
2022-12-01 01:09:29,636 #             RX packets 5  bytes 268
2022-12-01 01:09:29,637 #             TX packets 12 (Multicast: 9)  bytes 654
2022-12-01 01:09:29,638 #             TX succeeded 12 errors 0
2022-12-01 01:09:29,638 # 
```

==> ***FAILED*** (no public IPv6 address obtained)

**Comment by maribu** [comment]
@benpicco, @gschorcht: Any idea why 8.13 [failed](https://github.com/RIOT-OS/Release-Specs/issues/266#issuecomment-1332923103)?

Is the issue that my WiFi is using channel 11 and the test only succeeds when channel 6 is used?

**Comment by gschorcht** [comment]
> @benpicco, @gschorcht: Any idea why 8.13 [failed](https://github.com/RIOT-OS/Release-Specs/issues/266#issuecomment-1332923103)?
> 
> Is the issue that my WiFi is using channel 11 and the test only succeeds when channel 6 is used?

@maribu Unfortunatly, I can't  test it because my shitty Telekom Speedport Pro Plus Router doesn't support prefix delegation :worried:

What I can say is that if your WiFi is using channel 11, you have to configure the same channel for the ESP-NOW interface by `ESP_NOW_CHANNEL`. Try to add `CFLAGS='-DESP_NOW_CHANNEL=11' to your make command line for the border router and the ESP_NOW node.

**Comment by maribu** [comment]
I was told that @MrKevinWeiss ran the Contiki interop test and marked it as passed. Please holler if this is incorrect.

**Comment by leandrolanzieri** [comment]
> I was told that @MrKevinWeiss ran the Contiki interop test and marked it as passed. Please holler if this is incorrect.

I added the reference to the comment https://github.com/RIOT-OS/Release-Specs/issues/264#issuecomment-1302117849

**Comment by leandrolanzieri** [comment]
For the following tests I could not manage to reach addresses past the iotlab A8 node. There may be a missconfiguration. The RIOT node reaches the Linux host running on the A8 via the BR (running on the m3 node of the A8 board). We discussed this offline with @maribu, for now we will consider these passes, but he may re-run them on a different hardware later.

<details><summary>08. Interop - Task 05 <strong>[PASSED]</strong></summary>
<ul>
<li>Pinging the Linux host on the A8 node.</li>
</ul>

```

> ping -c 50 2001:660:3207:400::64
12 bytes from 2001:660:3207:400::64: icmp_seq=0 ttl=63 rssi=-64 dBm time=18.901 ms
12 bytes from 2001:660:3207:400::64: icmp_seq=1 ttl=63 rssi=-64 dBm time=26.593 ms
12 bytes from 2001:660:3207:400::64: icmp_seq=2 ttl=63 rssi=-64 dBm time=18.727 ms
12 bytes from 2001:660:3207:400::64: icmp_seq=3 ttl=63 rssi=-64 dBm time=26.988 ms
12 bytes from 2001:660:3207:400::64: icmp_seq=4 ttl=63 rssi=-64 dBm time=19.902 ms
12 bytes from 2001:660:3207:400::64: icmp_seq=7 ttl=63 rssi=-64 dBm time=25.003 ms
12 bytes from 2001:660:3207:400::64: icmp_seq=8 ttl=63 rssi=-64 dBm time=17.140 ms
12 bytes from 2001:660:3207:400::64: icmp_seq=9 ttl=63 rssi=-64 dBm time=25.445 ms
12 bytes from 2001:660:3207:400::64: icmp_seq=11 ttl=63 rssi=-64 dBm time=26.148 ms
12 bytes from 2001:660:3207:400::64: icmp_seq=12 ttl=63 rssi=-64 dBm time=17.127 ms
12 bytes from 2001:660:3207:400::64: icmp_seq=13 ttl=63 rssi=-64 dBm time=25.638 ms
12 bytes from 2001:660:3207:400::64: icmp_seq=14 ttl=63 rssi=-64 dBm time=16.485 ms
12 bytes from 2001:660:3207:400::64: icmp_seq=15 ttl=63 rssi=-64 dBm time=24.813 ms
12 bytes from 2001:660:3207:400::64: icmp_seq=16 ttl=63 rssi=-64 dBm time=17.677 ms
12 bytes from 2001:660:3207:400::64: icmp_seq=17 ttl=63 rssi=-64 dBm time=24.516 ms
12 bytes from 2001:660:3207:400::64: icmp_seq=18 ttl=63 rssi=-64 dBm time=17.455 ms
12 bytes from 2001:660:3207:400::64: icmp_seq=19 ttl=63 rssi=-64 dBm time=25.687 ms
12 bytes from 2001:660:3207:400::64: icmp_seq=20 ttl=63 rssi=-64 dBm time=16.906 ms
12 bytes from 2001:660:3207:400::64: icmp_seq=21 ttl=63 rssi=-64 dBm time=23.899 ms
12 bytes from 2001:660:3207:400::64: icmp_seq=22 ttl=63 rssi=-64 dBm time=16.366 ms
12 bytes from 2001:660:3207:400::64: icmp_seq=23 ttl=63 rssi=-64 dBm time=25.213 ms
12 bytes from 2001:660:3207:400::64: icmp_seq=24 ttl=63 rssi=-64 dBm time=16.404 ms
12 bytes from 2001:660:3207:400::64: icmp_seq=25 ttl=63 rssi=-64 dBm time=23.206 ms
12 bytes from 2001:660:3207:400::64: icmp_seq=26 ttl=63 rssi=-64 dBm time=15.014 ms
12 bytes from 2001:660:3207:400::64: icmp_seq=27 ttl=63 rssi=-64 dBm time=23.136 ms
12 bytes from 2001:660:3207:400::64: icmp_seq=28 ttl=63 rssi=-64 dBm time=15.728 ms
12 bytes from 2001:660:3207:400::64: icmp_seq=29 ttl=63 rssi=-64 dBm time=25.161 ms
12 bytes from 2001:660:3207:400::64: icmp_seq=30 ttl=63 rssi=-64 dBm time=16.698 ms
12 bytes from 2001:660:3207:400::64: icmp_seq=31 ttl=63 rssi=-64 dBm time=24.919 ms
12 bytes from 2001:660:3207:400::64: icmp_seq=32 ttl=63 rssi=-64 dBm time=16.557 ms
12 bytes from 2001:660:3207:400::64: icmp_seq=33 ttl=63 rssi=-64 dBm time=24.110 ms
12 bytes from 2001:660:3207:400::64: icmp_seq=34 ttl=63 rssi=-64 dBm time=15.530 ms
12 bytes from 2001:660:3207:400::64: icmp_seq=35 ttl=63 rssi=-64 dBm time=22.381 ms
12 bytes from 2001:660:3207:400::64: icmp_seq=36 ttl=63 rssi=-64 dBm time=14.800 ms
12 bytes from 2001:660:3207:400::64: icmp_seq=37 ttl=63 rssi=-64 dBm time=53.115 ms
12 bytes from 2001:660:3207:400::64: icmp_seq=39 ttl=63 rssi=-64 dBm time=22.324 ms
12 bytes from 2001:660:3207:400::64: icmp_seq=40 ttl=63 rssi=-64 dBm time=29.857 ms
12 bytes from 2001:660:3207:400::64: icmp_seq=41 ttl=63 rssi=-64 dBm time=21.221 ms
12 bytes from 2001:660:3207:400::64: icmp_seq=43 ttl=63 rssi=-64 dBm time=20.678 ms
12 bytes from 2001:660:3207:400::64: icmp_seq=44 ttl=63 rssi=-64 dBm time=29.411 ms
12 bytes from 2001:660:3207:400::64: icmp_seq=45 ttl=63 rssi=-64 dBm time=20.724 ms
12 bytes from 2001:660:3207:400::64: icmp_seq=46 ttl=63 rssi=-64 dBm time=27.229 ms
12 bytes from 2001:660:3207:400::64: icmp_seq=47 ttl=63 rssi=-64 dBm time=19.235 ms
12 bytes from 2001:660:3207:400::64: icmp_seq=48 ttl=63 rssi=-64 dBm time=27.408 ms
12 bytes from 2001:660:3207:400::64: icmp_seq=49 ttl=63 rssi=-64 dBm time=19.976 ms

--- 2001:660:3207:400::64 PING statistics ---
50 packets transmitted, 45 packets received, 10% packet loss
round-trip min/avg/max = 14.800/22.254/53.115 ms
```
</details>

---

<details><summary> 08. Interop - Task 06 <strong>[PASSED]</strong></summary>
<ul>
<li>Sending 8 bytes to the UDP echo server on the A8 node.</li>
</ul>

```

udp send 2001:660:3207:400::64 1234 "riot1234"
Success: sent 8 byte(s) to [2001:660:3207:400::64]:1234
> 
> PKTDUMP: data received:
~~ SNIP  0 - size:   8 byte, type: NETTYPE_UNDEF (0)
00000000  72  69  6F  74  31  32  33  34
~~ SNIP  1 - size:   8 byte, type: NETTYPE_UDP (4)
   src-port:  1234  dst-port:  1234
   length: 16  cksum: 0x966c
~~ SNIP  2 - size:  40 byte, type: NETTYPE_IPV6 (2)
traffic class: 0x00 (ECN: 0x0, DSCP: 0x00)
flow label: 0xbf92e
length: 16  next header: 17  hop limit: 63
source address: 2001:660:3207:400::64
destination address: 2001:660:3207:464:6462:640c:2c76:6afc
~~ SNIP  3 - size:  24 byte, type: NETTYPE_NETIF (-1)
if_pid: 6  rssi: -64  lqi: 255
flags: 0x0
src_l2addr: 5E:A3:8E:A2:3A:63:56:77
dst_l2addr: 66:62:64:0C:2C:76:6A:FC
~~ PKT    -  4 snips, total size:  80 byte
```
</details>

--- 
<details><summary>08. Interop - Task 07 <strong>[PASSED]</strong></summary>
<ul>
<li>Sending 200 bytes to the UDP echo server on the A8 node.</li>
<li>No pktbuf overflow.</li>
</ul>

```
main(): This is RIOT! (Version: 2023.01-devel-84-ge2513-HEAD)
> udp server start 1234
Success: started UDP server on port 1234
> 
> udp send 2001:660:3207:400::64 1234 200 10
Success: send 200 byte to [2001:660:3207:400::64]:1234
Packets received: 1
Success: send 200 byte to [2001:660:3207:400::64]:1234
Packets received: 2
Success: send 200 byte to [2001:660:3207:400::64]:1234
Packets received: 3
Success: send 200 byte to [2001:660:3207:400::64]:1234
Packets received: 4
Success: send 200 byte to [2001:660:3207:400::64]:1234
Packets received: 5
Success: send 200 byte to [2001:660:3207:400::64]:1234
Packets received: 6
Success: send 200 byte to [2001:660:3207:400::64]:1234
Packets received: 7
Success: send 200 byte to [2001:660:3207:400::64]:1234
Packets received: 8
Success: send 200 byte to [2001:660:3207:400::64]:1234
Packets received: 9
Success: send 200 byte to [2001:660:3207:400::64]:1234
Packets received: 10
> 
```
</details>

**Comment by leandrolanzieri** [comment]
`tcpdump` shows packets arriving to the A8 node, and they show up in its `eth0` interface... :/

```
root@node-a8-100:~# tcpdump -i eth0 icmp6     
tcpdump: verbose output suppressed, use -v or -vv for full protocol decode
listening on eth0, link-type EN10MB (Ethernet), capture size 262144 bytes
19:23:52.748005 IP6 2001:660:3207:464:6462:640c:2c76:6afc > 2001:660:3207:4bf::17: ICMP6, echo request, seq 0, length 12
19:23:53.755800 IP6 2001:660:3207:464:6462:640c:2c76:6afc > 2001:660:3207:4bf::17: ICMP6, echo request, seq 1, length 12
19:23:54.747732 IP6 2001:660:3207:464:6462:640c:2c76:6afc > 2001:660:3207:4bf::17: ICMP6, echo request, seq 2, length 12
```

**Comment by gschorcht** [comment]
> I finally got the ESP border router working

Was it the ESP-NOW channel or something else?

**Comment by maribu** [comment]
Both. I have two routers (one that I chose with OpenWrt, one that I didn't chose with a proprietary firmware that I need to connect to the ISP). I was struggling hard to get prefix delegation working from the first router to the second to the boarder router. I still ended up with the boarder router choosing the ULA over the public prefix and assumed it to be an issue with my router setup, but it is rather a bug in RIOT. Disabling ULA in the OpenWRT box workes around the issue.

If the second ESP switched the channel at runtime to the one ESP border router chose (it picked the acccess point with the best signal and used the same channel for ESP NOW), I had no connectivity between the two ESPs.

I think it did work once to switch the channel at run time. But I am not sure anymore.

**Comment by kaspar030** [comment]
> * [examples/rust-gcoap](https://github.com/maribu/riot-test-results/blob/main/2022.10-branch-e251312aeaed93b2a8c09b1978152c92ee5a8c1d/native/examples/rust-gcoap/compilation.failed)
>   
>   * this is unexpected
> 
> * [tests/pkg_nanopb](https://github.com/maribu/riot-test-results/blob/main/2022.10-branch-e251312aeaed93b2a8c09b1978152c92ee5a8c1d/native/tests/pkg_nanopb/compilation.failed)
>   
>   * and so is this

It could compile those two on 2022.10-branch both on current arch and with `BUILD_IN_DOCKER=1`.

**Comment by jia200x** [comment]
I will run the missing interop tests during the day
